title,link,description,cafename,cafeurl
롯데카드로 온누리 사용시 별도 알림 안됨(상담원 연결),http://cafe.naver.com/loyaltylife/233553,"(엄마가 어떤 알림이 안오는지는 모르겠다고 하셔요) 롯데카드 상담원과 통화해봤는데, 디지털 온누리로... 하십니다…… 롯데카드는 온누리 사용한 지 확인하려면 디지털 온누리 어플에서 사용내역 확인하는 방법 뿐인가... ",[뉴스사사] 뉴스사사 스마트 컨슈머들...,https://cafe.naver.com/loyaltylife
기저귀 바우처 사용했는데 문자가 안와서요!(롯데카드 바우처),http://cafe.naver.com/imsanbu/74476346,롯데카드로 바우처 받았어요! 기저귀 바우처 사용하려고 롯데카드 띵샵에 가서 바우처 사용한다는 체크표시까지 하고 결제를 했는데 카드는 긁혔다고 나오구요! 제 롯데카드 누적금액까지도 나오는데 사회서비스... ,맘스홀릭 베이비 (340만 엄마들의 임신...,https://cafe.naver.com/imsanbu
롯데카드 리볼빙 이젠 안녕! 2금융권 대환대출로 갈아탔어요,http://cafe.naver.com/ahslzh/798362,롯데카드 리볼빙 때문에 정말 골치 아팠었거든요 ㅠㅠ 단기간에 갚기에는 금액이 너무 부담스러워서 결국 2금융권에서 대환대출로 갈아타버렸어요! 후련한 마음에 이렇게 후기를 남겨봅니다 제가 롯데카드 리볼빙을... ,[금융레시피]아파트론/채무통합/여성/...,https://cafe.naver.com/ahslzh
신속채무조정 비씨카드 연체,http://cafe.naver.com/ccrs5500/610789,그중 비씨카드만 연체 이력으로 인한 한도 축소 문자와 어플에 연체 기록이 있더라고요 다른 카드사들은 어플 들어가서 보면 이번달 결제 금액 0원이라 뜨는데 비씨카드는 연체금 포함 이번 달 결제 금액도 떠있구요 신용... ,신용회복위원회 공식카페,https://cafe.naver.com/ccrs5500
비씨카드,http://cafe.naver.com/bigbang2me/1857175,비씨카드 원래 페이북으로 보내 버리는거였나요ㅠ 1000번대로 들어갔는데 결제때메 튕겨버렸어요ㅠ 비씨카드로 결제하신 분 댓글좀 달아쥬세요..,"빅뱅 - 지드래곤, GD, 탑, 태양, 대성...",https://cafe.naver.com/bigbang2me
농수산바우처 카드 비씨카드로 등기로 오나요?,http://cafe.naver.com/cafe1535/1533673,농수산바우처 카드 집으로 배송을 선택했는데 비씨카드로 등기로 오나요?,복지 아는게 힘,https://cafe.naver.com/cafe1535
비씨카드 결제했는데 돈이 안들어와요ㅠㅠㅠ,http://cafe.naver.com/jihosoccer123/3147199,벤사들어가면 언제 입금된다 날짜 떠있는데 비씨카드는 안떠있네요 지금 3주 다되어가는데.. 액수도크고.. 원래 이렇게 늦나요?,아프니까 사장이다 [소상공인·자영업...,https://cafe.naver.com/jihosoccer123
위즈파크 비씨카드 vs 익싸 고민 중인데요.!,http://cafe.naver.com/lionsball/3236821,비씨카드존 (구 지니존)은 카메라에 잡히는 열 위치 익싸이팅은 덕아웃 쪽 뒷 열 위치 응원하는 걸 좋아해서 앞에 테이블 있을 필요 없지만 비씨카드존 가본 적이 없어서 가보고 싶기도 한데요 야구 볼 때 응원 &gt;&gt;&gt;&gt;&gt; 먹기... ,사자 사랑방 (삼성라이온즈 팬 커뮤니...,https://cafe.naver.com/lionsball
카드질문) 농협그린카드 질문있어요(이거 비씨카드네요????),http://cafe.naver.com/noljatravel/1144340,"충전 할 때 쓸거니까 이 카드 발급받고 할인받자~ 는 생각으로 농협그린카드를 발급받았는데 이거 받고보니 비씨카드네요..? 그러면 아래에 농협 무이자 6개월은 못받고, 비씨카드 무이자 4개월만 받을 수 있는거죠? ㅠㅠ 이런",★테슬라 [TKC] 모델S 모델3 모델X 모...,https://cafe.naver.com/noljatravel
"대한항공 | 수협, 제주은행 제휴카드 비씨카드로 편입",http://cafe.naver.com/loyaltylife/236705,"25년 4월 1일부로 수협, 제주은행카드는 비씨카드 배너를 통해 제휴 카드 상품을 확인할 수... - 제휴카드와 관련하여 더 궁금하신 사항은 수협, 제주은행 또는 비씨카드로 문의하시기 바랍니다.... ",[뉴스사사] 뉴스사사 스마트 컨슈머들...,https://cafe.naver.com/loyaltylife
"12일 비씨카드 1열 취켓팅 성공,,,",http://cafe.naver.com/lionsball/3236962,"생애 처음으로 비씨카드 1열을 가게 되네요 ㅋㅋㅋㅋㅋ 원래 금요일에 갈까 했는데,,, 퇴근길 보려고 일부러 스카이만 노렸는데,,, 이렇게 된 이상 뽕을 뽑아야겠어요!! 그나저나 위즈파크도 좀 비싸긴 비싸네요,,, 라팍이... ",사자 사랑방 (삼성라이온즈 팬 커뮤니...,https://cafe.naver.com/lionsball
"대한항공 | 수협, 제주은행 제휴카드 비씨카드로 편입",http://cafe.naver.com/hotellife/1925524,"25년 4월 1일부로 수협, 제주은행카드는 비씨카드 배너를 통해 제휴 카드 상품을 확인할 수... - 제휴카드와 관련하여 더 궁금하신 사항은 수협, 제주은행 또는 비씨카드로 문의하시기 바랍니다.... ",[스사사] 스마트컨슈머들의 호텔/항공...,https://cafe.naver.com/hotellife
[BC카드] 2025년 상반기 비씨카드 신입사원 채용 (~04/18),http://cafe.naver.com/dokkm/3065204,[BC카드] 2025년 상반기 비씨카드 신입사원 채용 (~04/18) ■ 접수기간 : 2025.04.11 (금) ~ 2025.04.18 (금) 17:00 ■ 고용형태 : 인턴/정규직 ■ 모집구분 : Biz/DX ■ 채용 홈페이지 바로가기,"독금사-금융자격증,AFPK,CFP,전산회계...",https://cafe.naver.com/dokkm
삼성카드론대환대출 진행 도와주셔서 감사합니다~,http://cafe.naver.com/kpaddon/129033,삼성카드론대환대출 진행 도와주신 덕분에 이자 많이 줄여볼 수 있었어요. 조건이 가능할까 했는데 문의... 삼성카드론대환대출 진행 도와주셔서 월 납부금도 그렇고 원래 받았던 금리보다 많이 줄여볼 수 있었습니다. 승인... ,[금융사이다]대출/햇살론/새희망홀씨/...,https://cafe.naver.com/kpaddon
삼성카드 추천,http://cafe.naver.com/shootgoal/1275212,삼성카드 들어가 보니 테슬라 전용 카드가 있는게 아니고 일반 삼성 카드 아무거나 발급 받아 구매 하는 거 같던데 맞는지와? 혹시 삼성카드 구매 하신 분들 중 추천 해주실 만한 카드 있으시면 추천 부탁 드립니다.,★테슬라 슈퍼 클럽 - 모델Y 주니퍼 모...,https://cafe.naver.com/shootgoal
삼성카드 단기대출 금리 많이 줄였어요.,http://cafe.naver.com/2realdotcom/116639,삼성카드 단기대출 금리가 부담이었는데요. 이번에 파란펜선생님 도움으로 많이 줄였습니다. 월 납부금도 그렇고 이래저래 감당하기가 힘들었는데 이번에 삼성카드 단기대출 상환하여서 속이 다 시원하네요.... ,무지개-채무통합/아파트론/대환대출/주...,https://cafe.naver.com/2realdotcom
모델Y 삼성카드 결제 질문 있습니다!,http://cafe.naver.com/allfm01/1709943,저는 삼성카드 일시불 1.5% 혜택을 받고자 합니다. 궁금한 것은 1. 아무 삼성카드나 가능한가? 2. 계약금 500만원도 삼성카드로 하면 1.5%가 가능한가? 3. 기존에 레퍼럴 코드? 같은거는 주니퍼에 적용이 되는건지 입니다.... ,"전기차동호회 - 현대 아이오닉5 6 9,기...",https://cafe.naver.com/allfm01
삼성카드 쓰시는 회원님들,http://cafe.naver.com/ps3friend/2264091,삼성카드 처음 써보는데요 삼성카드 쓰시는 회원님들 계실까요? 삼성카드 안내 보니까 5만원 이하 결제시에는 따로 결제 알림을 안주고 일일히 앱에 들아가서 이용내역 확인 해야된다는데 맞나요?? 만약에 문자나 카톡으로... ,PS5와 친구들 [PS/PS5/VR/PS4PRO/PRO/...,https://cafe.naver.com/ps3friend
ㅅㄷㅇㅇ 삼성카드 링크 결제 질문,http://cafe.naver.com/sssw/17384594,삼성카드 링크혜택 7퍼 할인이라되있는데 즉시구매 일반결제 삼성카드 눌러서 결제 넘어가면 할인안된금액만 나오는데.. 결제할땐 할인안된 금액으로 결제하는게 이게 맞는건가요? 결제일할인이란게 다음달 카드값... ,"●나이키매니아●에어조던,아디다스,슈...",https://cafe.naver.com/sssw
삼성카드 &amp; MILEAGE PLATINUM(스카이패스) 신용카드 추천드립니다~,http://cafe.naver.com/directwedding/7571515,바로 삼성카드 &amp; 마일리지 카드입니다. 결혼준비를 하면 카드 쓸 일이 정말 많은데요. 결제하는 대부분의... 물론 삼성카드 가맹정 업종 분류 기준에 의해 등록된 가맹점에 한해 적립이 가능하지만! 삼성카드 가맹점은 많은... ,다이렉트 결혼준비,https://cafe.naver.com/directwedding
포코 X6 pro 삼성카드 NFC 등록,http://cafe.naver.com/xst/709368,F3에서는 삼성카드를 설치했더니 &quot;기본 결제앱&quot;에서 선택하여 교통카드로 잘 사용하였습니다. 그럼데 X6 pro에서는 삼성카드를 설치해도 &quot;기본 결제앱(아래이미지)&quot;에 삼성카드 선택이 나오지 않네요. 삼성카드 앱에서... ,"샤오미스토리 - 테크, 가성비, 알뜰폰...",https://cafe.naver.com/xst
"Y 주니퍼 구매방법, 삼성카드 다이렉트 오토 등 문의 헷갈려요",http://cafe.naver.com/noljatravel/1146645,"2,729만원에 대한 [다이렉트 오토 삼성카드할부]가 위에 조건으로 진행되는 건가요? 위에 순서가 맞는지, 잘못된게 있는지 궁금합니다. 이렇게 하면, [다이렉트 오토 삼성카드할부]는 구매시에 자동으로... ",★테슬라 [TKC] 모델S 모델3 모델X 모...,https://cafe.naver.com/noljatravel
삼성카드 분할납부,http://cafe.naver.com/anycard/1502963,안녕하세요~ 얼마전 가전 가구 구매를 하기위해 임시한도 신청 후 부여받은 임시한도로 할부 구매하고 일시불로 긁은것도 부담이 되서 분할납부 신청을 했습니당 방금 삼성카드 어플 들어가서 보니 분할납부를 이용할수... ,신용카드 박물관,https://cafe.naver.com/anycard
애플페이 신한카드 등록 궁금합니다,http://cafe.naver.com/gangmok/1930492,"Q1) 신한카드가 애플페이랑 제휴했다는 건 들었는데, 애플페이 신한카드 등록이 실제로 지금 당장 가능한 건가요? 기사마다 시점이 다 달라서 혼란스럽더라고요. 제 지갑에 있는 신한 Deep Oil 카드로 해보려고 했는데 안... ",강남엄마 VS 목동엄마 ★ 베스트맘 따...,https://cafe.naver.com/gangmok
신한카드 현금서비스 정리하는거 도움 받았어요,http://cafe.naver.com/tevez0/124255,신한카드 현금서비스 과다로 돌려막는것이 한계에 다다라서 방법을 찾아야했어요 이대로는 도저히 안될 것 같았고 신한카드 현금서비스 만큼 한도 나오는 상품이 있다면 바로 선택해서 대환을 하고 싶었습니다 한가지... ,[금융스터디]대출/채무관리/신용관리/...,https://cafe.naver.com/tevez0
신한카드 장기카드대출 중도상환했습니다!,http://cafe.naver.com/2realdotcom/117157,신한카드 장기카드대출 중도상환했습니다!! 애초에 좀 더 신중하게 알아보고 택해야 했는데 돈이 급하단 핑계로ㅠ 올바른 결정을 하지 못했네요; 몇 달.. 신한카드 장기카드대출을 사용해 보니 직접적으로 느껴지는 단점이... ,무지개-채무통합/아파트론/대환대출/주...,https://cafe.naver.com/2realdotcom
신한카드 묻발 후기 및 발급되는 주관적인 생각&amp;팁,http://cafe.naver.com/anycard/1500427,항상 토스&amp;카카오페이 네이버페이에서 한도조회하면 나오던 신한카드가 발급 거부였는데 토스로... 원래 신한카드사에서 모바일 신청을 하면 하루 한번만 신청이 가능하나 토스 전산을 통해 신청하면 두번 신청이... ,신용카드 박물관,https://cafe.naver.com/anycard
교육급여 신한카드 아직...,http://cafe.naver.com/cafe1535/1558878,(경기)/3급지(광역·세종·창원)/4급지(그 외 지역) = - 현재 받고 있는 복지 또는 신청하려는 복지 = ⭐️신한카드로 신청하신분들 여러분 지급 되셨던데 저는 아직...신한카드 신청 하신분들중 아직 안들어 오신분들 계실까요?,복지 아는게 힘,https://cafe.naver.com/cafe1535
신한카드 유니온페이 결제가 안되네요 ㅜ,http://cafe.naver.com/taiwantour/1098317,트래블로그 유니온카드는 결제가 되던데.. 신한카드 어플 들어가도 설정 하는것도 없고.. 혹시 신한카드 대만에서 잘 사용되시나요? ㅜ 원래 편의점이나 mtr에선 결제가 안되는건지 ㅜㅠ 위스키 사야하는데 큰일이네요..,즐거운 대만여행~♬,https://cafe.naver.com/taiwantour
신한카드 아시아나 상품 발급 중단(샤크님 감사^^),http://cafe.naver.com/loyaltylife/237968,신한카드에서 아시아나 상품 발급 중단한다고 하여 샤크님 조언에 따라 얼마전에 발급했어요. 오늘 발급... (조건- 6개월간 신한카드 사용 안 한 사람) 뉴스사사 하죠? 이번달에는 이벤트에서 이 카드는 빠졌더라구요... ,[뉴스사사] 뉴스사사 스마트 컨슈머들...,https://cafe.naver.com/loyaltylife
신한카드,http://cafe.naver.com/ccrs5500/617540,아까 신한카드 채권 양도 한다고. 문자 왓드라고용^ 5월달에 양도한다네용~ 신복위 통해서 조정받고 납부중인데 이제서야 양도하는건 뭔뜻일까용???? 혹시 양도 되고 따로 갚아야 된다던지 압류 신한카드에서 압류 한다던지... ,신용회복위원회 공식카페,https://cafe.naver.com/ccrs5500
뮷즈 x 신한카드 트립패스 출시,http://cafe.naver.com/amateurmagician/59989,외국인 대상으로 트립패스 카드가 박물관재단과 신한카드가 협업하여 선불카드를 제작했습니다 구매는 국립중앙박물관 상품관에서 할 수 있습니다 기쁜소식!! 외국인만 사용가능한게 아닙니다 여권정보가 있으면... ,아트프렌즈 Art Friends 미술관 갤러리...,https://cafe.naver.com/amateurmagician
뮤지컬 지킬앤하이드 신한카드 The Moment 다녀왔어요 ~♡,http://cafe.naver.com/hexenyang/50843,신한카드로 뮤지컬 1+1 아이들 데리고 가려고 4장 구입했는데 본 공연은 14세 이상 (2012년생 포함 이전... 눈도 오더니 또 마칠때쯤은 화창하고~~ 신한카드 the moment 다음엔 위키드일까요? 다음 광고는 위키드 붙어있더라구요,[Loyal Travel Club : LTC]쉬운 호텔/...,https://cafe.naver.com/hexenyang
신한 쏠트래블 세븐ATM,http://cafe.naver.com/okinawago/548503,"쏠트래블 로칼 가서 인출불가했다는 이슈 들으니 신한 쏠트래블 카드만 믿고 환전하려고했는데 급 불안합니다. 이게 여행 가기전에 한국에서 무엇을 확인하고 가야하는지 모르겠고,, 비번이나,,인출테스트 이런거,, 일단... ",오키나와 달인 카페,https://cafe.naver.com/okinawago
"쏠트래블 , 트래블 웰렛 이용방법",http://cafe.naver.com/singaporelove/451065,내일 드디어 출발하는데 쏠트래블이랑 트래블 웰렛 카드를 만들었는데 어떻게 써야하는건지 찾아봐도 잘 모르겠어요 ㅠㅠ 쏠트래블 외환카드에 원화 입금하면 현지에서 바로 인출 사용 가능한건가요? 현금 이체했다... ,[싱사]싱가폴 사랑 - 싱가포르 대표 카...,https://cafe.naver.com/singaporelove
쏠트래블 카드 인천 라운지 무료이용권 관련해서요,http://cafe.naver.com/worldtravelcafe/970756,쏠트래블 카드 인천 라운지 이용 무료건이요~ 전월 실적이 이거 쏠 트래블 카드 실적을 말하는 걸까요? 아니면 연계해놓은 제 계좌 신한 카드 실적을 말하는걸까요?,[오사카홀릭] & 도쿄홀릭_오사카 여행...,https://cafe.naver.com/worldtravelcafe
cu 쏠트래블 할인이 안되여 ㅜㅜ,http://cafe.naver.com/brownu12nn/476670,구매하구 쏠트래블 신한 터치로 결제했는데 왜 할인안될까요 ㅜㅜ? 실물만 되는지 읽어봐도 없어서 ㅜㅜ,소소하지만 확실한 행복.,https://cafe.naver.com/brownu12nn
쏠트래블 환전 이렇게 하면 되나요??,http://cafe.naver.com/happyibook/5324388,"한국에서 달러 환전 후 다낭 도착해서 동으로 환전하는게 제일 추천많이 하는 방법인걸 봤는데요, 1일차에 쓸 돈 일부만 달러 가져가서 한시장에서 환전하고 제가 쏠트래블 카드가 있어서 atm기로 뽑으면 수수료가... ","다낭 도깨비 - 베트남 다낭자유여행 ,...",https://cafe.naver.com/happyibook
오 쏠트래블 환전 들어갔더니 1581이라 냉큼 바꿨어요!,http://cafe.naver.com/momsolleh/770157,새벽에 1581까지 찍고 지금은 1592길래 움 바꿀까 말까 고민중이었는데 쏠트래블 카드 환율 1581인거보고 냉큼 500유로 바꿨습니당ㅋㅋㅋ 다들 쏠트래블 환전 가세요~~~ 한 500유로+현금 더 바꿔야하는데.. 지금 더... ,"체크인유럽#유럽여행,스위스,스페인,이...",https://cafe.naver.com/momsolleh
신한 쏠트래블카드 발급이요!!!,http://cafe.naver.com/doorkong/3509259,이번에 해외여행가는데 신한 쏠트래블 체크카드 발급 받아볼까하는데요. 이거 발급받으면 환전 얼마 안해도 카드로 쉽게 쓸수있을까요? 근데 이거 체크카드인데 왜 연회비가 있는건가요? 혹시 쏠트래블 체크카드 쓰시는분... ,안산 시흥 맘 모여라,https://cafe.naver.com/doorkong
신한 쏠트래블 체크카드 CU할인 있나봐요,http://cafe.naver.com/wjdrkrjqn/89199,신한은행이 해외여행 특화카드인 ‘SOL트래블 체크카드’의 국내 혜택을 늘린다. 31일 신한은행에 따르면 4월 한달간 CU편의점서 쏠트래블 체크카드로 빵과 냉장 디저트류 상품 구입시 최대 80%까지 할인해주는... ,"정가를 거부하는 사람들 (알뜰폰, 절약...",https://cafe.naver.com/wjdrkrjqn
신한 쏠트래블 체크카드 발급 후 준비사항?,http://cafe.naver.com/happyibook/5365424,이제 12일 밤 비행기로 출국인데 쏠 트래블 카드 관련해서 질문이 있습니다 그동안 모아두었던 달러와 유로가 있어서 그거 그대로 가져가서 미케비치에서 환전을 할거고 사용하다 돈이 떨어지면 5만원 짜리로... ,"다낭 도깨비 - 베트남 다낭자유여행 ,...",https://cafe.naver.com/happyibook
쏠트래블 출금 불가,http://cafe.naver.com/foreverhk/1346133,남편명의 쏠트래블카드를 제가 들고 왔는데 어제 종일 결제는 되는데 현금 출금이 안되었어요 ㅜㅜ 문제는 친구들 4명 여행에 제가 총무이고 오늘 제니쿠키를 가야하는데 현금이 없다는거죠ㅜㅜ지금 비자카드와... ,〓▷▶포에버 홍콩◀◁〓/〓▷▶포에버...,https://cafe.naver.com/foreverhk
우리카드리볼빙대환 할 수 있도록 도와주셨어요,http://cafe.naver.com/kpaddon/129091,우리카드리볼빙대환 하기가 쉽지가 않을거라고 생각을 했었는데 다행히 제게도 방법이 있었습니다 어떻게 하면 이미 사용중인걸 정리할 수 있을까 고민을 많이 하고 있던 시점에 애플팀장님께 우리카드리볼빙대환 할 수... ,[금융사이다]대출/햇살론/새희망홀씨/...,https://cafe.naver.com/kpaddon
우리카드 상담원 조선족인지?,http://cafe.naver.com/hotellife/1925334,우리카드는 발급받았다. 해지했다 사용해야 하는건가 하고 적응안되어 카드해지 하고 accor plus 직접가입하려고 우리카드 고객센터와 연락했는데.. 보이스 피싱인줄알았어요. 두번 통화했는데 두번 다 조선족 말투.... ,[스사사] 스마트컨슈머들의 호텔/항공...,https://cafe.naver.com/hotellife
우리카드 금융거래확인서 발급 받아 보신 분 ㅜㅜ,http://cafe.naver.com/jihosoccer123/3247478,안녕하세요 소상공인 대환대출 받을려고 지난주부터 우리카드에 금융거래확인서 신청하고 받았는데 우리카드 금융거래확인서는 아예 “대출용도”칸이 없더라구요 ㅠㅠ 그래서 지금. 은행에 반려당했는데 사업자대출로... ,아프니까 사장이다 [소상공인·자영업...,https://cafe.naver.com/jihosoccer123
우리카드+중올플 플랫후기,http://cafe.naver.com/loyaltylife/231778,"안녕하세요, 어제 여름휴가 호텔 보다가 플랫되는게 더 저렴할듯해서 우리카드+중올플 해서 오늘 플랫 달성했습니다. 하기전에 고민이 많았는데.. 1. 우리카드 아코르 인피니티 25년 1월 해지함. 2. 아코르플러스 유상... ",[뉴스사사] 뉴스사사 스마트 컨슈머들...,https://cafe.naver.com/loyaltylife
우리카드,http://cafe.naver.com/ccrs5500/611211,제가 우리카드 10만원정도 미냡있는데요 오늘 문지 받았는데요 기한의 이익상실 예정통지 이렇게 왔어여... 흑시 법적절차 들어가나요?? 아 흑시 우리카드쪽 미냡되는분들 이거 오시나요? 이런문자요 ㅠㅍ,신용회복위원회 공식카페,https://cafe.naver.com/ccrs5500
우리카드 리볼빙 해지 했어요 감사합니다ㅠㅠ,http://cafe.naver.com/getampedsolo/142759,유하나플래너님께서 우리카드 리볼빙 해지를 할 수 있도록 많은 도움 주셨어요 진짜 사람 하나 살리신... 당장 우리카드 리볼빙 해지를 할 수 있는 환경이 아니었어요 이게 빚을 괜히 지게 되는게 아닌 것 같더라고요 조그만... ,[채무스토리] 햇살론/직장인/사업자/주...,https://cafe.naver.com/getampedsolo
화물복지카드 우리카드 두 가지 있던데 차이점이 뭐죠?,http://cafe.naver.com/truckerking/1104436,"상세보기에서 얼핏 보면 오른쪽 카드가 할인율이 나아보이기도 하는데, 삼성카드는 발급 받았고, 우리카드 하나 추가발급 하려는데 카드의 정석을 많이 쓰시는 것 같더라구요. 차이점 알 필요 없이 카드의 정석이 옳은... ",영운모/화물/화물운송/영업용화물차/화...,https://cafe.naver.com/truckerking
아코르 플러스 우리카드 인피니티로 가입만 해놓은상태인데....,http://cafe.naver.com/checkincafe/123729,"를러스도 우리카드가 아니라 말레이시아를 통해 가입하면 스플2개 제공등 좀더 유리한점이 있긴한데. 어차피 현아플 카드도 없애는 마당에 프리미엄 카드도 필요했어서, 우리카드 주력으로 써서. 내년은 카드 실적으로... ",[어디든 체크인] 전 세계 호텔 정보 N...,https://cafe.naver.com/checkincafe
아코르 플러스 &amp; 우리카드 비교 정리 (2025년 3월 기준) 및 리워드 사용방법,http://cafe.naver.com/singaporelove/451183,"하...) 아코르 플러스 &amp; 우리카드 비교 정리 (2025년 3월 기준) ✔ 아코르 플러스 멤버십 VPN을 통해... ✔ 우리카드 인피니트 연회비 50만 원 숙박권 1장 + 1,400 리워드 포인트 제공 1,400 리워드로 1박 숙박 가능 (세금 포함... ",[싱사]싱가폴 사랑 - 싱가포르 대표 카...,https://cafe.naver.com/singaporelove
우리카드 카드의정석 사용하시는분 계신가요?,http://cafe.naver.com/anycallusershow/4953725,우리카드 사용하면 문자로 얼마사용 오는데 저는 왜 안올까요 신청까지 다 했는데.. 혹시 어떤번호로 문자오는지요.. 우리카드 사용하시는분 !,삼성스마트폰-갤럭시Z플립6/폴드6/갤럭...,https://cafe.naver.com/anycallusershow
현대카드로 국립서양미술관,http://cafe.naver.com/jpnstory/3941961,"현대카드로 국립서양미술관 볼 수 있다네요, 무료로! 저는 그것도 모르고 미리 예매하고 왔는데, 현대카드 있는 분들은 보러 다녀와보세요. 로뎅. 마네. 모네, 르누아르, 피카소 등 다양한 작품 볼 수 있는데, 좋아요.... ",네일동 : 일본여행카페,https://cafe.naver.com/jpnstory
결혼준비카드 현대카드 대한항공카드300,http://cafe.naver.com/directwedding/7540479,"중 현대카드 대한항공카드 300을 발급받게 되었습니다. 사용 후기를 공유하며, 카드 혜택도 함께 정리해볼게요. --- 1. 카드 발급 과정 현대카드는 다른 카드사에 비해 비교적 심사가 빠른 편인데, 저는 온라인으로... ",다이렉트 결혼준비,https://cafe.naver.com/directwedding
현대카드 장기대출 중도 상환해버렸습니다!!,http://cafe.naver.com/kpaddon/129176,현대카드 장기대출 중도 상환해버렸습니다! 급전을 마련해야 하는 상황이라 여러 곳을 비교할 정신이 없기도... 이럴 거면 다른 금융사를 알아보고 갈아타는 게 맞겠다 싶어 현대카드 장기대출 상환방법을 확인해 보기... ,[금융사이다]대출/햇살론/새희망홀씨/...,https://cafe.naver.com/kpaddon
현대카드 장기대출 빌린거 대환으로 정리 다했어요,http://cafe.naver.com/aa37/104625,현대카드 장기대출부터 다른 신용카드 장기대출 이용이 두드러지면서 신용점수하락이 많았어요 이번해... 큰 현대카드 장기대출부터 정리를 할수 있음 좋겠다고 생각하게 되었구요 아무래도 장기대출 단기대출은 좀... ,"&lt;채무맨투맨&gt;대출,아파트론,주부,무직...",https://cafe.naver.com/aa37
