title,link,description,cafename,cafeurl
Sc제일현대카드 Zero Edition3,http://cafe.naver.com/anycard/1499156,현대카드 기보유자라서 Sc제일은행 신용카드 발급에 . 문제가 없었구여. 기존 신용카드 보유가 많으면... Sc제일은행은 현대카드 전산망 삼성카드 전산망 . 두 곳 다 이용하며 기존의 비씨카드와는 결별했습니다 . 전... ,신용카드 박물관,https://cafe.naver.com/anycard
현대카드 쓰시는분들 어떤 카드 쓰세요?,http://cafe.naver.com/jpnstory/3938982,현대카드 유저분들! 어떤카드 쓰시는지 궁금해요! 전 기본 엠카드(연회비3만원) 쓰고있는데 어차피 카드 많이 쓰는거.. ㅠ 회사 다 정리하고 한두장만 쓰려고요. 현대카드가 포인트적립이 쏠쏠한 너낌이 들어서 선택했는데... ,네일동 : 일본여행카페,https://cafe.naver.com/jpnstory
현대카드 추천,http://cafe.naver.com/orangevrdhj/360989,기존 블루멤버스 현대카드에서 다른 생활비 용도로(현대카드)바꾸고 싶은데 종류가 많아서 어렵네요. 혹시 현대카드 사용중이시면 추천 부탁 드려요. (현대카드 영사님도 추천 받습니다!),천안아산 불당맘 모여라,https://cafe.naver.com/orangevrdhj
빅카메라 현대카드 할인 면세적용,http://cafe.naver.com/whiskycognac/703217,빅카메라 현대카드 즉시할인금액이 면세가 적용되는건가요? 관세청에 전화해보니 현대카드 할인같은경우 누구나 받을수없는 할인이라 할인전금액으로 면세한도적용이된다는데 맞는건가싶네요ㅜㅜ 게시판 이용 주의 사항... ,위스키 코냑 클럽,https://cafe.naver.com/whiskycognac
현대카드 Good Friendship 이 있네요.,http://cafe.naver.com/loyaltylife/234268,현대카드 Good Friendship 멤버쉽 전용 혜택이 있더라고요. 1) 2만원 이상 구매시 30% 할인 ( 최대 7천원 ) 2) 조각케이크 구매시 아메리카노 증정 3) 홀케이크 예약시 20% 할인 ( 최대 9천원 ) 안내에는 현대카드앱... ,[뉴스사사] 뉴스사사 스마트 컨슈머들...,https://cafe.naver.com/loyaltylife
올리브영 현대카드 관련,http://cafe.naver.com/wjdrkrjqn/89551,"이거 올리브영 현대카드로 10만원, 3만원 받고 다음에 현대카드 신규 혜택받으려면 12개월 지나야 할까요? 아니면 결제이력 6개월에만 영향이있을까요 이번달 카카오페이에서 현카 신규발급 대상자보니까 12개월 이내... ","정가를 거부하는 사람들 (알뜰폰, 절약...",https://cafe.naver.com/wjdrkrjqn
kb국민카드장기대출 빌린거 정리했어요,http://cafe.naver.com/kpaddon/128911,kb국민카드장기대출 받은걸 계속 사용하는건 아니라고 판단이 들어서 체리팀장님께 상담을 받고서 정리하는 방향으로 이야기를 나눴습니다 당시에는 상황이 급하다보니까 kb국민카드장기대출을 빌릴 수 밖에... ,[금융사이다]대출/햇살론/새희망홀씨/...,https://cafe.naver.com/kpaddon
경험자분들의 kb국민카드 한도 하향시 대응방안 문의드립니다..,http://cafe.naver.com/anycard/1498128,오늘 아침 뜬금없이 kb 국민카드에서 한도 하향한도는 문자를 받았습니다.. 연체는 7년간 한번도 없었고요.. 카드한도는 현금서비스 100만원포함 80% 정도 사용중에 있었습니다.. 그런데 아래와 같이 50% 이상 한도... ,신용카드 박물관,https://cafe.naver.com/anycard
KB국민카드 일본 여행에서 사용하면 좋겠어요,http://cafe.naver.com/hexenyang/49633,봄에 벚꽃보러 일본여행가실 분들 계시면 KB국민카드 HERITAGE Classic도 미리 챙기세요!! 2월부터 7월까지 캐시백 프로모션을 해서 일본 가맹점에서 쓰면 20% 캐시백으로 돌려받을 수 있어요! 일본 편의점에서 이용해도... ,[Loyal Travel Club : LTC]쉬운 호텔/...,https://cafe.naver.com/hexenyang
KB국민카드중에요,http://cafe.naver.com/worldtravelcafe/953877,제가 일본여행가려고 알아보다 보니까 KB국민카드 중에 헤리티지클래식 할인형? 이게 일본에서 혜택도 좋고 괜찮은거 같은데 이거 사용하시는분 계실까요??,[오사카홀릭] & 도쿄홀릭_오사카 여행...,https://cafe.naver.com/worldtravelcafe
KB국민카드에서 내용증명 우편 오신분들~!,http://cafe.naver.com/ccrs5500/608016,어제 오늘 지방가느라 집을 비웠는데 kb국민카드에서 우편못받아서 스티커붙여놓고갔어요. 보통 등기는 올때 연락오는데 이건 일반우편도아니고 등기도아니고 뭐죠? 내용증명이라 써있어서 놀래가지고 까페들어와보니... ,신용회복위원회 공식카페,https://cafe.naver.com/ccrs5500
KB국민카드 or 삼성카드??,http://cafe.naver.com/usem/2381470,KB국민카드나 삼성카드 중 혜택 좋은거 뭐가 있을까요? 기존에 롯데카드 사용 중인데 80만원 이상 사용해도 아무런 혜택이 없어서 신규로 다른카드 발급해볼까해서요 현금 혜택 많이 주는 카드 영사분 있으면 전화번호... ,『파주 운정맘』파주 운정신도시 사람...,https://cafe.naver.com/usem
KB 국민카드 쓰시는 분들 계신가요?,http://cafe.naver.com/gpfleamarket/3844402,남친이 KB 국민카드에서 무슨 전화를 받은건지 보이스피싱인지 LG전자 가전제품을 준다고 연락을 받았나봐요 근데 카드 값 59800원 씩 200개월 적금 넣으라고 했대요. 그 돈은 돌려준대요. 카드 결제로 적금 넣은건... ,김행나-김포여인들의 행복한 나눔(김포...,https://cafe.naver.com/gpfleamarket
Kb 국민카드 대출 문의드려요,http://cafe.naver.com/anycard/1499202,kb국민 이지신용대출 1600 14프로에 가능하다고 나오는데 찾아보니까 카드론인것 같습니다 혹시 카드론 받으면 점수 많이 떨어지나요?? 금액을 많이 받을수록 더 떨어지는 걸까요?? 지금 점수는 kcb 796 나이스... ,신용카드 박물관,https://cafe.naver.com/anycard
애플페이 국민카드 등록 언제 될까요?,http://cafe.naver.com/gangmok/1930528,"현대카드로 애플페이 쓰다가 KB국민카드 메인으로 넘어온 지 석 달째입니다. 혜택은 확실히 KB 쪽이 더 나아서 바꾸긴 했는데, 막상 실생활에서는 불편함이 너무 커요. 애플페이 국민카드 등록이 되기만 하면 해결될... ",강남엄마 VS 목동엄마 ★ 베스트맘 따...,https://cafe.naver.com/gangmok
사고사였던 KB국민 카드 드디어 발급..ㅎㅎ,http://cafe.naver.com/anycard/1498126,사고사였던 KB국민 카드 드디어 발급 되었습니다 ㅎㅎ 작년 8월달에 카드 발급 신청했을 때 거래정기 관련해서 등록이 되어 있다고 문자를 받아서 그래서 자동으론 해제 일자로 부터 5년 뒤에 자동으로 풀리는데... ,신용카드 박물관,https://cafe.naver.com/anycard
